{
  "$schema": "http://json-schema.org/draft-07/schema#",
  "$id": "https://lmc-cis.github.io/Shared-Tools/schema/tool.schema.json",
  "title": "Academic Tools in Development — tool.json",
  "description": "Metadata for one catalog entry. Lives at catalog/<slug>/tool.json.",
  "type": "object",
  "additionalProperties": false,
  "required": [
    "name",
    "summary",
    "type",
    "audience",
    "runsOn",
    "author",
    "contact",
    "version",
    "status",
    "lastTested",
    "dataHandling",
    "license",
    "ferpaConfirmed"
  ],
  "properties": {
    "$schema": {
      "type": "string",
      "description": "Optional pointer to this schema so editors can offer autocomplete."
    },
    "name": {
      "type": "string",
      "minLength": 3,
      "maxLength": 80,
      "description": "Display name of the tool."
    },
    "summary": {
      "type": "string",
      "minLength": 10,
      "maxLength": 200,
      "description": "One or two sentences shown on the card."
    },
    "type": {
      "type": "string",
      "enum": ["bookmarklet", "skill", "guide", "workflow", "app", "extension", "other"],
      "description": "What kind of resource this is. Controls the how-to-use instructions."
    },
    "audience": {
      "type": "array",
      "minItems": 1,
      "uniqueItems": true,
      "items": { "type": "string", "enum": ["students", "faculty", "staff"] },
      "description": "Who the tool is for."
    },
    "runsOn": {
      "type": "array",
      "minItems": 1,
      "uniqueItems": true,
      "items": { "type": "string", "minLength": 1, "maxLength": 60 },
      "description": "Systems the tool works with, as free text (e.g. \"Canvas\", \"Chrome\", \"Claude\")."
    },
    "author": {
      "type": "string",
      "minLength": 2,
      "maxLength": 120,
      "description": "Person or group to credit."
    },
    "contact": {
      "type": "string",
      "minLength": 3,
      "maxLength": 200,
      "pattern": "^(mailto:)?[^@\\s]+@[^@\\s]+\\.[^@\\s]+$|^https://\\S+$",
      "description": "An email address or https:// URL where people can reach the author."
    },
    "version": {
      "type": "string",
      "minLength": 1,
      "maxLength": 40,
      "description": "Version label, free text (e.g. \"0.1.0\")."
    },
    "status": {
      "type": "string",
      "enum": ["active", "experimental", "unmaintained", "retired"],
      "description": "Current maintenance state."
    },
    "lastTested": {
      "type": ["string", "null"],
      "format": "date",
      "description": "Date (YYYY-MM-DD) the tool was last tested in its stated environment, or null if never."
    },
    "source": {
      "type": "string",
      "format": "uri",
      "pattern": "^https://",
      "description": "Where the code lives, for linked tools (must start with https://)."
    },
    "files": {
      "type": "array",
      "minItems": 1,
      "uniqueItems": true,
      "items": { "type": "string", "minLength": 1 },
      "description": "Files in this tool's folder that visitors can view or download (hosted tools)."
    },
    "primaryFile": {
      "type": "string",
      "minLength": 1,
      "description": "Which of the files the main button should use. Defaults to the first entry in files."
    },
    "bookmarkletCode": {
      "type": "string",
      "format": "uri",
      "pattern": "^https://",
      "description": "Linked bookmarklets only: an https:// URL to the raw JavaScript (e.g. raw.githubusercontent.com) so the site can build the drag button."
    },
    "dataHandling": {
      "type": "string",
      "minLength": 10,
      "maxLength": 300,
      "description": "One sentence on what data the tool reads, stores, or sends."
    },
    "license": {
      "type": "string",
      "minLength": 2,
      "maxLength": 60,
      "description": "License identifier, e.g. MIT or CC-BY-4.0."
    },
    "ferpaConfirmed": {
      "type": "boolean",
      "const": true,
      "description": "Must be true: the contributor confirms FERPA and student privacy were considered and no real student data is included."
    },
    "tags": {
      "type": "array",
      "uniqueItems": true,
      "items": { "type": "string", "minLength": 1, "maxLength": 40 },
      "description": "Extra search keywords."
    },
    "todo": {
      "type": "boolean",
      "description": "Marks a placeholder entry that has no working code yet."
    }
  },
  "anyOf": [
    { "required": ["source"] },
    { "required": ["files"] }
  ]
}
